resource_id,source,title,url,resource_type,format,course_type,openings,color,author,author_title,level_min,level_max,level_tier,duration_min,price_eur,is_free,has_video,has_pgn,has_exercises,has_spaced_rep,rating_score,views_yt,pub_date,description,level_tier_original,level_tier_source,level_tier_new
mc__play_the_kan_sicilian_complete_repertoir,modern_chess,Play the Kan Sicilian - Complete Repertoire for BlackUpdated,https://www.modern-chess.com/course/play-the-kan-sicilian-complete-repertoire-for-black/55024/,course,interactive,opening,Sicilian Defense|1.e4,Black,GMMichael Roiz,GM,1200.0,3000.0,intermediate,,,0,0,1.0,1.0,1.0,,,,"The current database provides a complete Kan repertoire for Black. The course consists of 25 theoretical chapters, 25 interactive test positions, and Memory Booster.The survey consists of four big sections - Systems with 5.c4, Systems with 5.Nc3, Systems with 5.Bd3, and Various Options on Move 5.",intermediate,fallback_lmin,intermediate
mc__1_c4_nf6_2_nc3_aggressive_repertoire_aga,modern_chess,"1.c4 Nf6 2.Nc3 - Aggressive Repertoire against 2...e6, 2...c5, and 2...d5",https://www.modern-chess.com/course/1-c4-nf6-2-nc3-aggressive-repertoire-against-2-e6-2-c5-and-2-d5/14991/,course,video,opening,English Opening|1.c4,Both,GMMihail Marin,GM,1200.0,3000.0,intermediate,330.0,,0,1,1.0,1.0,1.0,,,,"We are happy to introduce the newest opening project by GM Mihail Marin - 1.c4 Nf6 2.Nc3 - Aggressive Repertoire against 2...e6, 2...c5, and 2...d5.This huge database includes 48 theoretical chapters, a Memory Booster, and a Video Version with almost 5h and 30min of running time. Additionally, at th",intermediate,fallback_lmin,intermediate
mc__opposite_coloured_bishops_in_the_middleg,modern_chess,Opposite-Coloured Bishops in the Middlegame,https://www.modern-chess.com/course/opposite-coloured-bishops-in-the-middlegame/64958/,course,video,middlegame,,Both,GMValeriy Aveskulov,GM,2300.0,3000.0,expert,,,0,1,1.0,1.0,0.0,,,,One of the most important positions to learn is those with opposite-coloured bishops.Developing expertise in middlegames with opposite-coloured bishops can be very time-consuming. To do so you can read different manuals about middlegame play;  most will have at least a chapter about such positions. ,expert,range_only,expert
mc__understand_the_scandinavian,modern_chess,Understand the Scandinavian,https://www.modern-chess.com/course/understand-the-scandinavian/24925/,course,video,opening,Scandinavian Defense|1.e4,Both,GMIoannis Papaioannou,GM,1200.0,3000.0,intermediate,360.0,,0,1,1.0,0.0,0.0,,,,"The workshop of GM Papaioannou - Understand the Scandinavian is already a digital product.This product includes all the videos from the workshop as well as the PGN file related to the training sessions. Overall, the material consists of approximately 6 hours of video and a PGN database which include",intermediate,fallback_lmin,intermediate
mc__1_c4_e5_2_nc3_complete_repertoire_for_wh,modern_chess,1.c4 e5 2.Nc3 - Complete Repertoire for White,https://www.modern-chess.com/course/1-c4-e5-2-nc3-complete-repertoire-for-white/74892/,course,video,opening,English Opening|1.c4,White,GMMihail Marin,GM,1200.0,3000.0,intermediate,360.0,,0,1,1.0,1.0,1.0,,,,"We are happy to introduce the newest opening project by GM Mihail Marin - 1.c4 e5 2.Nc3 - Complete Repertoire for White.This huge database includes 42 theoretical chapters, a Memory Booster, and a Video Version with almost 6 hours of running time. Additionally, at the end of the database, you will f",intermediate,fallback_lmin,intermediate
mc__semi_slav_complete_repertoire_for_black_,modern_chess,Semi-Slav - Complete Repertoire for Black - Part 2,https://www.modern-chess.com/course/semi-slav-complete-repertoire-for-black-part-2/34859/,course,video,opening,Slav Defense|Semi-Slav Defense|1.d4,Black,GMRenato Quintiliano,GM,1200.0,3000.0,intermediate,270.0,,0,1,1.0,1.0,1.0,,,,"The current database completes the survey of the Semi-Slav which was initiated by the previous database. The course consists of 11 theoretical chapters, 22 interactive test positions, a Memory Booster, and Video Version (4.5h Running Time).The starting position of the database arises after 1.d4 d5 2",intermediate,fallback_lmin,intermediate
mc__queens_gambit_complete_repertoire_for_wh,modern_chess,Queen’s Gambit Complete Repertoire for White with GM Tamas Fodor,https://www.modern-chess.com/course/queens-gambit-complete-repertoire-for-white-with-gm-tamas-fodor/84826/,course,video,opening,Queen%27s Gambit Accepted|Queen%27s Gambit Declined,White,Modern Chess Team,,0.0,1200.0,beginner,,,0,1,1.0,0.0,0.0,,,,"GM Fodor, with his unique insights and practical experience, throws new light into the Queen’s Gambit as an opening. And whether you are a beginner or a seasoned chess player, we guarantee you will absolutely love this course.",beginner,range_only,beginner
mc__slav_defense_exchange_variation_vol_i_ii,modern_chess,Slav Defense Exchange Variation Vol. I-II with GM Sipke Ernst,https://www.modern-chess.com/course/slav-defense-exchange-variation-vol-i-ii-with-gm-sipke-ernst/44793/,course,video,opening,Slav Defense|1.d4,Both,Modern Chess Team,,1200.0,3000.0,intermediate,,,0,1,1.0,0.0,0.0,,,,"In this two-part series, GM Sipke Ernst will show you all the important Exchange Slav ideas for White, covering main strategies and attacking schemes in the process. Even if your opponent deviates from the theory, you’ll be able to quickly come up with a good plan and obtain an advantage.",intermediate,fallback_lmin,intermediate
mc__symmetrical_english_with_3_d4_complete_r,modern_chess,Symmetrical English with 3.d4 - Complete Repertoire for White,https://www.modern-chess.com/course/symmetrical-english-with-3-d4-complete-repertoire-for-white/94760/,course,video,opening,English Opening|1.c4,White,GMMihail Marin,GM,1200.0,3000.0,intermediate,240.0,,0,1,1.0,1.0,1.0,,,,"We are happy to introduce the newest opening project by GM Mihail Marin - Symmetrical English with 3.d4 - Complete Repertoire for White.This huge database includes 28 theoretical chapters, a Memory Booster, and a Video Version with 4 hours running time. Additionally, at the end of the database, you ",intermediate,fallback_lmin,intermediate
mc__slav_setups_against_english_reti_and_lar,modern_chess,"Slav Setups against English Reti, and Larsen",https://www.modern-chess.com/course/slav-setups-against-english-reti-and-larsen/54727/,course,video,opening,Slav Defense|1.d4,Both,"GMDavorin Kuljasevic, GMGrigor Grigorov, GMKrasimir Rusev, GMMihail Marin, GMPetar G. Arnaudov",GM,2300.0,3000.0,expert,450.0,,0,1,1.0,0.0,0.0,,,,"November 24, 2021Slav Defense1.d4",expert,range_only,expert
mc__semi_slav_complete_repertoire_for_black,modern_chess,Semi-Slav - Complete Repertoire for Black,https://www.modern-chess.com/course/semi-slav-complete-repertoire-for-black/14694/,course,video,opening,Slav Defense|Semi-Slav Defense|1.d4,Black,GMRenato Quintiliano,GM,1200.0,3000.0,intermediate,600.0,,0,1,1.0,1.0,1.0,,,,"We are happy to present the new database of IM Renato Quintiliano - Semi-Slav - Complete Repertoire for Black. The database consists of 10 huge theoretical chapters, 20 interactive test positions, and Memory Booster. The running time of the Video Version is 7.5 hours.",intermediate,fallback_lmin,intermediate
mc__understand_the_slav_defense,modern_chess,Understand the Slav Defense,https://www.modern-chess.com/course/understand-the-slav-defense/24628/,course,video,opening,Slav Defense|1.d4,Both,"GMBoris Avrukh, GMDavorin Kuljasevic, GMDejan Bojkov, GMIoannis Papaioannou, GMMichael Roiz, GMPetar G. Arnaudov",GM,2300.0,3000.0,expert,540.0,,0,1,1.0,0.0,0.0,,,,"November 12, 2021Slav Defense1.d4",expert,range_only,expert
mc__the_power_of_the_bishop_pair,modern_chess,The Power of the Bishop Pair,https://www.modern-chess.com/course/the-power-of-the-bishop-pair/74595/,course,video,general,,Both,Modern Chess Team,,1200.0,3000.0,intermediate,,,0,1,0.0,0.0,0.0,,,,Using and playing against the bishop pair is one of the most important skills in chess. The right evaluating of the bishop pair is crucial for many openings as well.The content is divided into 11 sections. Each one of them contains a number of model games and examples. The author has worked on this ,intermediate,fallback_lmin,intermediate
mc__play_the_accelerated_dragon_systems_with,modern_chess,Play the Accelerated Dragon - Systems with 5.Nc3,https://www.modern-chess.com/course/play-the-accelerated-dragon-systems-with-5-nc3/34562/,course,interactive,opening,Sicilian Defense|1.e4,Both,GMMartin Lorenzini,GM,1200.0,3000.0,intermediate,,,0,0,1.0,1.0,1.0,,,,"We are happy to present the second part of the Accelerated Dragon course by GM Salvador Alonso and GM Martin Lorenzini. In this course, they cover all the systems without c2-c4.The current survey consists of 13 theoretical chapters, 2 model games, 15 interactive test positions, and Memory Booster.",intermediate,fallback_lmin,intermediate
mc__understand_the_torre_attack_1_d4_nf6_2_n,modern_chess,Understand the Torre Attack - 1.d4 Nf6 2.Nf3 g6 3.Bg5,https://www.modern-chess.com/course/understand-the-torre-attack-1-d4-nf6-2-nf3-g6-3-bg5/84529/,course,video,opening,Torre Attack|1.d4,Both,GMIoannis Papaioannou,GM,2300.0,3000.0,expert,,,0,1,1.0,0.0,0.0,,,,Are you tired of studying complicated computer lines in Gruenfeld and King's Indian Defence? Would you like to play an anti-computer system that is entirely based on the understanding of the pawn structures? GM Papaioannou is here to teach one of his favourite systems - Torre Attack. In this worksho,expert,range_only,expert
mc__understand_the_classical_sicilian,modern_chess,Understand the Classical Sicilian,https://www.modern-chess.com/course/understand-the-classical-sicilian/44496/,course,video,opening,Sicilian Defense|1.e4,Both,"GMBoris Avrukh, GMGrigor Grigorov, GMKrasimir Rusev, GMMihail Marin, GMPetar G. Arnaudov",GM,2300.0,3000.0,expert,450.0,,0,1,1.0,1.0,0.0,,,,"October 13, 2021Sicilian Defense1.e4",expert,range_only,expert
mc__attacking_1_d4_repertoire_for_white_with,modern_chess,Attacking 1.d4 Repertoire for White with IM Robert Ris,https://www.modern-chess.com/course/attacking-1-d4-repertoire-for-white-with-im-robert-ris/94463/,course,video,opening,1.d4,White,Modern Chess Team,,1200.0,3000.0,intermediate,630.0,,0,1,1.0,0.0,0.0,,,,"Over 10.5 hours of high-quality video training, jampacked into 36 chapters… Robert goes over ALL the main lines of the 1.d4 opening, starting from the complicated KID to the fearsome Nimzo-Indian to the mysterious Tarrasch.",intermediate,fallback_lmin,intermediate
mc__1_nf3_d5_2_g3_nc6_practical_solution_for,modern_chess,1.Nf3 d5 2.g3 Nc6 - Practical Solution for Black,https://www.modern-chess.com/course/1-nf3-d5-2-g3-nc6-practical-solution-for-black/54430/,course,video,opening,Reti Opening|1.Nf3,Black,GMMihail Marin,GM,1200.0,3000.0,intermediate,,,0,1,1.0,1.0,1.0,,,,"The Reti move order (1.Nf3 d5 2.g3) can be quite irritating, depending on the repertoire of the player with Black. In most lines, it is almost impossible to force White to deviate from his flexible setup, based on a later d2-d3 and an attack against the centre with either c2-c4 or e2-e4.Things would",intermediate,fallback_lmin,intermediate
mc__understand_the_nimzo_indian_defense,modern_chess,Understand the Nimzo-Indian Defense,https://www.modern-chess.com/course/understand-the-nimzo-indian-defense/14397/,course,video,opening,Nimzo-Indian Defense|1.d4,Both,"GMBoris Avrukh, GMGrigor Grigorov, GMMichael Roiz, GMMihail Marin, GMPetar G. Arnaudov",GM,2300.0,3000.0,expert,480.0,,0,1,1.0,1.0,0.0,,,,"September 28, 2021Nimzo-Indian Defense1.d4",expert,range_only,expert
mc__understand_the_caro_kann,modern_chess,Understand the Caro-Kann,https://www.modern-chess.com/course/understand-the-caro-kann/74298/,course,video,opening,Caro-Kann Defense|1.e4,Both,GMDejan Bojkov,GM,1200.0,3000.0,intermediate,,,0,1,1.0,0.0,0.0,,,,"In this video course, GM Dejan Bojkov presents the most important tactical and positional ideas in Caro-Kann Defence. Each one of the 20 video lessons is supported by a PGN version with extensive annotations.Regardless of whether you play the Caro-Kann Defence with White or Black, this video course ",intermediate,fallback_lmin,intermediate
mc__understand_the_bogo_indian,modern_chess,Understand the Bogo-Indian,https://www.modern-chess.com/course/understand-the-bogo-indian/34265/,course,video,opening,Bogo-Indian Defense|1.d4,Both,GMIoannis Papaioannou,GM,2300.0,3000.0,expert,270.0,,0,1,1.0,0.0,0.0,,,,"The masterclass of GM Papaioannou - Understand the Bogo-Indian is already a digital product.This product includes all the videos from the masterclass as well as the PGN file related to the training sessions. Overall, the material consists of approximately 4.5 hours of video and a PGN database which ",expert,range_only,expert
mc__1_d4_d5_2_c4_e6_3_nc3_c5_complete_repert,modern_chess,1.d4 d5 2.c4 e6 3.Nc3 c5 - Complete Repertoire for Black,https://www.modern-chess.com/course/1-d4-d5-2-c4-e6-3-nc3-c5-complete-repertoire-for-black/84232/,course,video,opening,Tarrasch Defense|1.d4,Black,GMPavel Eljanov,GM,1200.0,3000.0,intermediate,,,0,1,1.0,1.0,1.0,,,,"We are happy to present the newest opening research by GM Pavel Eljanov. This time, he provides a complete repertoire for Black after 1.d4 d5 2.c4 e6 3.Nc3 c5Actually, the idea of the database is not to provide another Tarrasch repertoire. The cornerstone of the current survey is the position arisin",intermediate,fallback_lmin,intermediate
mc__play_the_accelerated_dragon_maroczy_bind,modern_chess,Play the Accelerated Dragon - Maroczy Bind,https://www.modern-chess.com/course/play-the-accelerated-dragon-maroczy-bind/44199/,course,interactive,opening,Sicilian Defense|1.e4,Both,GMMartin Lorenzini,GM,2300.0,3000.0,expert,,,0,0,1.0,1.0,1.0,,,,"We are happy to present the database Play the Accelerated Dragon - Maroczy Bind. This course has been created by two grandmasters - GM Martin Lorenzini and GM Salvador Alonso. In the second part of their project, they will cover the remaining systems for White (other than Maroczy Bind), thus complet",expert,range_only,expert
mc__semi_tarrasch_endgame_line,modern_chess,Semi-Tarrasch Endgame Line,https://www.modern-chess.com/course/semi-tarrasch-endgame-line/54133/,course,video,opening,Semi-Tarrasch Defense|1.d4,Both,GMSwapnil Dhopade,GM,1200.0,3000.0,intermediate,,,0,1,1.0,0.0,1.0,,,,"We are happy to present the newest database by GM Swapnil Dhopade - Semi-Tarrasch  Endgame Line. In this project, GM Dhopade provides a complete repertoire for Black after 1.d4 Nf6 2.c4 e6 3.Nf3 d5 4.Nc3 c5. While the database is based on the endgame arising after 5.cxd5 cxd4 6.Qxd4 exd5 7.e4 dxe4, ",intermediate,fallback_lmin,intermediate
mc__play_the_moscow_variation,modern_chess,Play the Moscow Variation,https://www.modern-chess.com/course/play-the-moscow-variation/14100/,course,video,opening,Slav Defense|1.d4,Both,GMRenato Quintiliano,GM,1200.0,3000.0,intermediate,,,0,1,1.0,1.0,1.0,,,,"The database is divided into 2 parts - Moscow Variation and Anti-Moscow Gambit. The database includes the following components: Typical Pawn Structures, 15 Theoretical Chapters, 36 Interactive Test Positions, 4 Hours Video Running Time, and Memory Booster.",intermediate,fallback_lmin,intermediate
mc__modern_repertoire_against_the_benoni,modern_chess,Modern Repertoire against the Benoni,https://www.modern-chess.com/course/modern-repertoire-against-the-benoni/64067/,course,video,opening,Modern Benoni Defense|1.d4,Both,GMBoris Avrukh,GM,1200.0,3000.0,intermediate,,,0,1,1.0,0.0,1.0,,,,"In the current database, GM Boris Avrukh provides a complete solution against the Modern Benoni.The starting position of the survey arises after 1.d4 Nf6 2.c4 c5 3.d5 e6 4.Nc3 exd5 5.cxd5 d6 6.e4 g6 7.h3 Bg7 8.Nf3 0-0 9.Be3In the introduction to this survey, GM Avrukh states:Inspired by the recent g",intermediate,fallback_lmin,intermediate
mc__1_b3_larsen_opening_with_gm_raunak_sadhw,modern_chess,1.b3 Larsen Opening with GM Raunak Sadhwani),https://www.modern-chess.com/course/1-b3-larsen-opening-with-gm-raunak-sadhwani/24034/,course,video,opening,Larsen Opening|1.b3,Both,Modern Chess Team,,2300.0,3000.0,expert,,,0,1,1.0,0.0,0.0,,,,"GM Raunak Sadhwani, the 9th youngest grandmaster in chess history and a chess prodigy, is here with his first-ever chess course 1.b3 opening for White. This sharp, almost unexplored opening is studied and decoded by Sadhwani in this exclusive 7-hour video training with real game commentaries and lin",expert,range_only,expert
mc__understand_the_trompowsky_theoretical_tr,modern_chess,Understand the Trompowsky - Theoretical Trends,https://www.modern-chess.com/course/understand-the-trompowsky-theoretical-trends/74001/,course,video,opening,Trompowsky Attack|1.d4,Both,"GMAlexander Moiseenko, GMIoannis Papaioannou, GMMichael Roiz",GM,2300.0,3000.0,expert,300.0,,0,1,1.0,1.0,0.0,,,,"August 13, 2021Trompowsky Attack1.d4",expert,range_only,expert
mc__understand_the_trompowsky_typical_pawn_s,modern_chess,Understand the Trompowsky - Typical Pawn Structures,https://www.modern-chess.com/course/understand-the-trompowsky-typical-pawn-structures/33968/,course,video,opening,Trompowsky Attack|1.d4,Both,"GMGrigor Grigorov, GMKrasimir Rusev, GMSwapnil Dhopade",GM,2300.0,3000.0,expert,300.0,,0,1,1.0,1.0,0.0,,,,"August 2, 2021Trompowsky Attack1.d4",expert,range_only,expert
mc__complete_dragon_repertoire,modern_chess,Complete Dragon Repertoire,https://www.modern-chess.com/course/complete-dragon-repertoire/43902/,course,video,opening,Sicilian Defense|1.e4,Both,GMMihail Marin,GM,1200.0,3000.0,intermediate,120.0,,0,1,1.0,0.0,1.0,,,,"We have the pleasure to present a unique opening course by GM Mihail Marin - Complete Dragon Repertoire. This opening database is different from everything we have been doing so far.The material consists of the following components: Theoretical Part (51 Opening Chapters), Video Part (2 hours running",intermediate,fallback_lmin,intermediate
mc__reti_opening_pawn_structures_strategy_ta,modern_chess,"Reti Opening - Pawn Structures, Strategy, Tactical Ideas, and Theoretical Trends",https://www.modern-chess.com/course/reti-opening-pawn-structures-strategy-tactical-ideas-and-theoretical-trends/93869/,course,video,opening,Reti Opening|1.Nf3,Both,"GMBoris Avrukh, GMDavorin Kuljasevic, GMDejan Bojkov, GMGrigor Grigorov, GMMihail Marin, GMPetar G. Arnaudov",GM,1200.0,3000.0,intermediate,600.0,,0,1,1.0,1.0,0.0,,,,"July 14, 2021Reti Opening1.Nf3",intermediate,fallback_lmin,intermediate
mc__ambitious_repertoire_against_the_london_,modern_chess,Ambitious Repertoire against the London System,https://www.modern-chess.com/course/ambitious-repertoire-against-the-london-system/53836/,course,video,opening,London System|1.d4,Both,GMBoris Avrukh,GM,1200.0,3000.0,intermediate,100.0,,0,1,1.0,0.0,1.0,,,,"In this course (based on a group lecture), GM Boris Avrukh builds a reliable and ambitious repertoire for Black against the London System. The foundation of his approach are the setups with ...g7-g6.True to his style, Avrukh provides many new and less explored ideas, thus tremendously increasing the",intermediate,fallback_lmin,intermediate
mc__sicilian_defense_kalashnikov_variation_w,modern_chess,Sicilian Defense: Kalashnikov Variation with GM Misa Pap,https://www.modern-chess.com/course/sicilian-defense-kalashnikov-variation-with-gm-misa-pap/13803/,course,video,opening,Sicilian Defense|1.e4,Both,Modern Chess Team,,2300.0,3000.0,expert,,,0,1,1.0,0.0,0.0,,,,"The Sicilian Defense is easily one of the hardest openings to master—especially when you are playing an “open” line like the Kalashnikov!This 10-hour video training on the Sicilian Kalashnikov covers the main ideas behind Black’s setup, the positional opportunities, the dangers lurking behind. It he",expert,range_only,expert
mc__learn_from_garry_kasparov_with_gm_pap_gy,modern_chess,Learn from Garry Kasparov  with GM Pap Gyula,https://www.modern-chess.com/course/learn-from-garry-kasparov-with-gm-pap-gyula/63770/,course,video,general,,Both,Modern Chess Team,,1200.0,3000.0,intermediate,,,0,1,1.0,0.0,0.0,,,,"GM Gyula Pap is here with his brand-new course 'Learn from Garry Kasparov', a huge 10+ hours of video training to help you decode the complex move choices in his games, the general approach toward chess, and how to simply run over his opponents like a steamroller!",intermediate,fallback_lmin,intermediate
mc__practical_rook_endgames,modern_chess,Practical Rook Endgames,https://www.modern-chess.com/course/practical-rook-endgames/33671/,course,video,endgame,,Both,"GMDavorin Kuljasevic, GMGrigor Grigorov, GMIoannis Papaioannou, GMPetar G. Arnaudov",GM,1200.0,3000.0,intermediate,420.0,,0,1,1.0,1.0,0.0,,,,"June 18, 2021",intermediate,fallback_lmin,intermediate
mc__ambitious_repertoire_against_the_italian,modern_chess,Ambitious Repertoire against the Italian Game,https://www.modern-chess.com/course/ambitious-repertoire-against-the-italian-game/83638/,course,interactive,opening,Italian Game|1.e4,Both,GMKiril Georgiev,GM,1200.0,3000.0,intermediate,,,0,0,1.0,1.0,1.0,,,,"The Italian Game is nowadays as a good old wine, there is rarely a week with less than a new hundred games in it. All the leading players are engaged in the heavy theoretical discussion, in a recent match between MVL and Nakamura the real battle even started after move 21. The purpose of this databa",intermediate,fallback_lmin,intermediate
mc__expert_repertoire_against_vienna_and_rag,modern_chess,Expert Repertoire against Vienna and Ragozin,https://www.modern-chess.com/course/expert-repertoire-against-vienna-and-ragozin/43605/,course,video,opening,Ragozin Defense|Vienna Variation|1.d4,Both,GMGyula Pap,GM,2300.0,3000.0,expert,,,0,1,1.0,1.0,1.0,,,,"In his first opening project for Modern Chess, GM Gyula Pap builds repertoire against two of the most popular and reliable openings - Ragozin Defence and Vienna Variation. From the perspective of the ambitious tournament player, this repertoire provides a lot of value. GM Pap goes for relatively une",expert,range_only,expert
mc__understand_the_sicilian_20_must_know_con,modern_chess,Understand the Sicilian - 20 Must-Know Concepts,https://www.modern-chess.com/course/understand-the-sicilian-20-must-know-concepts/93572/,course,interactive,opening,Sicilian Defense|1.e4,Both,GMDejan Bojkov,GM,1200.0,3000.0,intermediate,,,0,0,1.0,0.0,0.0,,,,"In this introductory course, GM Bojkov presents to you the main pawn structures and most common strategical ideas for both sides to build upon our knowledge for the future.The Sicilian Defence is and will remain one of the most complex openings, but the proper understanding of the middle game and en",intermediate,fallback_lmin,intermediate
mc__attack_with_scotch_game_gm_gm_avetik_gri,modern_chess,Attack with Scotch Game - GM GM Avetik Grigoryan and GM Samvel Ter-Sahakyan,https://www.modern-chess.com/course/attack-with-scotch-game-gm-gm-avetik-grigoryan-and-gm-samvel-ter-sahakyan/53539/,course,video,opening,Scotch Game|1.e4,Both,Modern Chess Team,,1800.0,2300.0,advanced,,,0,1,0.0,0.0,0.0,,,,"Players from all levels struggle to find a reliable repertoire for White after 1.e4 e5. Usually, Black is able to achieve a rock-solid position without theoretical problems.In this course, Armenian grandmasters Avetik Grigoryan and Samvel Ter-Sahakyan make a strong case for the Scotch Game that aris",advanced,range_only,advanced
mc__rook_vs_minor_piece_in_the_endgame,modern_chess,Rook vs Minor Piece in the Endgame,https://www.modern-chess.com/course/rook-vs-minor-piece-in-the-endgame/63473/,course,video,endgame,,Both,"GMDejan Bojkov, GMGrigor Grigorov",GM,2300.0,3000.0,expert,240.0,,0,1,1.0,0.0,0.0,,,,"May 20, 2021",expert,range_only,expert
mc__eljanovs_algorithm,modern_chess,Eljanov's Algorithm,https://www.modern-chess.com/course/eljanovs-algorithm/23440/,course,video,general,,Both,GMPavel Eljanov,GM,2300.0,3000.0,expert,,,0,1,1.0,0.0,0.0,,,,"Most of the players want to understand the decision-making process of top-level grandmasters. The vast majority of the learning resources present different elements of chess knowledge. When you play a practical game, however, you should be able to connect the points in order to make the optimal deci",expert,range_only,expert
mc__symmetrical_english_complete_repertoire_,modern_chess,Symmetrical English - Complete Repertoire for Black,https://www.modern-chess.com/course/symmetrical-english-complete-repertoire-for-black/83341/,course,video,opening,English Opening,Black,GMSwapnil Dhopade,GM,1200.0,3000.0,intermediate,240.0,,0,1,1.0,1.0,1.0,,,,"Welcome to the Symmetrical English Repertoire Against 1.c4. 1.c4 has gained a lot of popularity these days. It is catching up with moves like 1.d4 and 1.e4.1.c4 also provides many opportunities to transpose to other openings in 1.d4, for example, the Catalan Defence.",intermediate,fallback_lmin,intermediate
mc__practical_decision_making,modern_chess,Practical Decision Making,https://www.modern-chess.com/course/practical-decision-making/43308/,course,video,general,,Both,"GMDavorin Kuljasevic, GMDejan Bojkov, GMGrigor Grigorov, GMIoannis Papaioannou, GMMihail Marin, GMPetar G. Arnaudov",GM,1200.0,3000.0,intermediate,540.0,,0,1,1.0,1.0,0.0,,,,"May 5, 2021",intermediate,fallback_lmin,intermediate
mc__arkhangelsk_variation_lifetime_solution_,modern_chess,Arkhangelsk Variation - Lifetime Solution for BlackUpdated,https://www.modern-chess.com/course/arkhangelsk-variation-lifetime-solution-for-black/53242/,course,video,opening,Ruy Lopez|1.e4,Black,GMBoris Avrukh,GM,2300.0,3000.0,expert,360.0,,0,1,1.0,1.0,1.0,,,,"Welcome to the latest opening project of GM Boris Avrukh - Arkhangelsk Variation. Having worked on this opening with Fabiano Caruana, Avrukh is one of the biggest Arkhangelsk experts in the world.",expert,range_only,expert
