resource_id,source,title,url,resource_type,format,course_type,openings,color,author,author_title,level_min,level_max,level_tier,duration_min,price_eur,is_free,has_video,has_pgn,has_exercises,has_spaced_rep,rating_score,views_yt,pub_date,description,level_tier_original,level_tier_source,level_tier_new
yt__fmsiowldkyu,youtube,How to Win with The Scandinavian Defense | ChessKid,https://www.youtube.com/watch?v=FMSiOWldkyU,video,video,opening,Scandinavian Defense,Black,ChessKid,,1000.0,3000.0,intermediate,,0.0,1,1,,,,,30516.0,2023-07-21,"Quick! Your opponent plays the popular opening, e4. What to do, what to do?... Play d5! The Scandinavian Defense.

In today's chess video, FunMasterMike will show you how to win for black using the Scandinavian Defense. 

✔️ Sign up for FREE online play: https://www.chesskid.com/home
💙 Like us on Fa",intermediate,range_only,intermediate
yt__eponkvgdevc,youtube,Learn the Scandinavian Defense in 7 Minutes!,https://www.youtube.com/watch?v=EpOnkvgdevc,video,video,opening,Scandinavian Defense,Black,Kamryn,,1000.0,3000.0,intermediate,,0.0,1,1,,,,,14923.0,2024-02-01,"TWITTER: https://twitter.com/kamrynheidi

TWITCH: https://www.twitch.tv/kamrynheidi

DISCORD: https://discord.gg/nnvRnWFzyW

MERCH: https://kamrynheidi.creator-spring.com

VOD CHANNEL: https://youtube.com/@kamrynvods

Join Chess.com: https://www.chess.com/?ref_id=136665470 [This is an affiliate link",intermediate,range_only,intermediate
yt__p0eqv6ylnay,youtube,CRUSH Your Opponents in 9 Moves With This Scandinavian Defense Variation,https://www.youtube.com/watch?v=p0EQV6yLnaY,video,video,opening,Scandinavian Defense,Black,Remote Chess Academy,,1200.0,2000.0,intermediate,,0.0,1,1,,,,,148202.0,2023-02-27,"Learn 3 Ways To Improve Your Chess Results
FREE Masterclass ► https://chess-teacher.com/masterclass

Take Your Chess Skills To The Next Level With High-Quality Courses
Learn here ► https://online.chess-teacher.com/

💰💲 Join the RCA Affiliate Program, promote our courses, and get 50% commission - htt",intermediate,range_only,intermediate
yt__5am6kp2vjtk,youtube,BEGINNER GUIDE TO THE ITALIAN GAME,https://www.youtube.com/watch?v=5aM6KP2VJtk,video,video,opening,Italian Game,White,Volclus,,1000.0,3000.0,intermediate,,0.0,1,1,,,,,102796.0,2023-05-08,"Hello everyone! This is a no-nonsense guide to playing the Italian Game, designed to show a beginner everything they need to know to start playing.

PGN:
1. e4 e5 2. Nf3 Nc6 (2... Nf6 3. d4 Nxe4 (3... exd4 4. e5 Nd5 5. Qxd4 Nb6 6.
Nc3) 4. Nxe5 d5 5. Bd3 c6 6. O-O) (2... d6 3. d4 exd4 4. Nxd4 Nf6 5. ",intermediate,range_only,intermediate
yt__mhns8glo894,youtube,Learn the Italian Game in 20 Minutes [Chess Opening Crash Course],https://www.youtube.com/watch?v=MhNs8GLo894,video,video,opening,Italian Game,White,Remote Chess Academy,,1200.0,2000.0,intermediate,,0.0,1,1,,,,,1144240.0,2023-01-27,"Learn 3 Simple Rules To Reach 2000+ ELO Rating Faster
FREE Masterclass ► https://chess-teacher.net/masterclassyt/

Take Your Chess Skills To The Next Level With High-Quality Courses
Learn here ►https://online.chess-teacher.com/shopyd

💰💲 Join the RCA Affiliate Program, promote our courses, and get 5",intermediate,range_only,intermediate
yt__nwhgmhxetie,youtube,Italian Game - Chess Openings,https://www.youtube.com/watch?v=NWHGmHXEtIE,video,video,opening,Italian Game,White,thechesswebsite,,1000.0,3000.0,intermediate,,0.0,1,1,,,,,651601.0,2015-03-10,"The Italian Game, one of the oldest openings in chess, can be both aggressive and extremely passive. We look at all the variations you need to know to play the Italian game to fit your style of play.

For information on more openings check out http://www.thechesswebsite.com/chess-openings/",intermediate,range_only,intermediate
yt__ywlmjuinlbm,youtube,"The Complete Italian Game Guide | Gambits, Traps for White & Black",https://www.youtube.com/watch?v=yWlMjUiNLBM,video,video,opening,Italian Game,White,Remote Chess Academy,,1200.0,2000.0,intermediate,,0.0,1,1,,,,,71546.0,2025-11-17,"🔥 *You don’t need more openings—you need a better thinking process. GM Smirnov’s FREE masterclass teaches you just that* ► https://chess-teacher.net/masterclassyt/

⌛ *GM Smirnov has spent years mastering chess—so you don’t have to. Learn from his courses* ► https://online.chess-teacher.com/shopyd

",intermediate,range_only,intermediate
yt__i_vxu6dlyom,youtube,5 WINNING Attacking PLANS in the Italian Game for White,https://www.youtube.com/watch?v=I_VXU6dlYOM,video,video,opening,Italian Game,White,Remote Chess Academy,,1200.0,2000.0,intermediate,,0.0,1,1,,,,,653793.0,2023-10-18,"Learn 3 Simple Rules To Reach 2000+ ELO Rating Faster
FREE Masterclass ► https://chess-teacher.net/masterclassyt/

Take Your Chess Skills To The Next Level With High-Quality Courses
Learn here ►https://online.chess-teacher.com/shopyd

💰💲 Join the RCA Affiliate Program, promote our courses, and get 5",intermediate,range_only,intermediate
yt__ga2sqprhekq,youtube,Magnus Carlsen shows us how to play The Italian Opening,https://www.youtube.com/watch?v=ga2SQprHEkQ,video,video,opening,Italian Game,White,Theguywholikeschess,,1000.0,3000.0,intermediate,,0.0,1,1,,,,,71802.0,2025-09-21,Credits: @TakeTakeTakeApp,intermediate,range_only,intermediate
yt__nyteqjbpisu,youtube,Learn the Italian game in 17 mins,https://www.youtube.com/watch?v=nYTEqjBpiSU,video,video,opening,Italian Game,White,ChesswithAkeem,,1000.0,3000.0,intermediate,,0.0,1,1,,,,,108571.0,2025-05-30,"👉 want to inprove at Chess faster? Watch this video      https://youtu.be/P1D5yC6L_K0?si=wavp4-C71bVic-tW

Want my exclusive videos only available for my private students ? Support me on Patreon by clicking this link  https://www.patreon.com/chesslife?utm_campaign=creatorshare_creator

Im Akeem a Ch",intermediate,range_only,intermediate
yt__emvd6t_1uhw,youtube,Magnus Carlsen shows us how to play the Italian Opening,https://www.youtube.com/watch?v=EmVD6t_1uhw,video,video,opening,Italian Game,White,Theguywholikeschess,,1000.0,3000.0,intermediate,,0.0,1,1,,,,,90767.0,2025-06-21,CREDITS: https://www.youtube.com/@TakeTakeTakeApp/videos,intermediate,range_only,intermediate
man__my_system,manual,My System,https://www.amazon.com/s?k=My+System+Nimzowitsch,book,text,middlegame,,Both,Nimzowitsch,,1400.0,2200.0,advanced,,20.0,0,0,0.0,0.0,0.0,,,,"Fundamental positional chess: blockade, prophylaxis, overprotection.",intermediate,range_only,advanced
man__chess_fundamentals,manual,Chess Fundamentals,https://www.gutenberg.org/ebooks/33370,book,text,general,,Both,Capablanca,,0.0,1400.0,beginner,,0.0,1,0,0.0,0.0,0.0,,,,Essential principles for beginners. Free on Project Gutenberg.,beginner,range_only,beginner
man__dvoretsky_s_endgame_manual,manual,Dvoretsky's Endgame Manual,https://www.amazon.com/s?k=Dvoretsky+Endgame+Manual,book,text,endgame,,Both,Dvoretsky,,2000.0,3000.0,expert,,35.0,0,0,0.0,1.0,0.0,,,,Definitive endgame reference for advanced and master-level players.,advanced,range_only,expert
man__silman_s_complete_endgame_course,manual,Silman's Complete Endgame Course,https://www.amazon.com/s?k=Silman+Complete+Endgame,book,text,endgame,,Both,Silman,,800.0,2200.0,intermediate,,25.0,0,0,0.0,1.0,0.0,,,,Endgame curriculum organized by rating level from beginner to master.,beginner,range_only,intermediate
man__winning_chess_tactics,manual,Winning Chess Tactics,https://www.amazon.com/s?k=Winning+Chess+Tactics+Seirawan,book,text,tactics,,Both,Seirawan,,800.0,1600.0,intermediate,,20.0,0,0,0.0,1.0,0.0,,,,"Systematic introduction to forks, pins, skewers and discovered attacks.",beginner,range_only,intermediate
man__understanding_chess_middlegames,manual,Understanding Chess Middlegames,https://www.amazon.com/s?k=Understanding+Chess+Middlegames+Nunn,book,text,middlegame,,Both,Nunn,,1800.0,2600.0,expert,,28.0,0,0,0.0,1.0,0.0,,,,100 middlegame principles with examples from GM games.,advanced,range_only,expert
man__the_sicilian_najdorf,manual,The Sicilian Najdorf,https://www.amazon.com/s?k=Kasparov+Sicilian+Najdorf,book,text,opening,Sicilian Defense,Black,Kasparov,,1800.0,3000.0,advanced,,30.0,0,0,0.0,0.0,0.0,,,,Kasparov's definitive analysis of the Najdorf Sicilian.,advanced,range_only,advanced
man__play_the_london_system,manual,Play the London System,https://www.amazon.com/s?k=Play+London+System+Johnsen,book,text,opening,London System,White,Sverre Johnsen,,1000.0,1800.0,intermediate,,22.0,0,0,0.0,0.0,0.0,,,,Complete practical guide to the London System for White.,beginner,range_only,intermediate
man__pump_up_your_rating,manual,Pump Up Your Rating,https://www.amazon.com/s?k=Pump+Up+Your+Rating+Axel+Smith,book,text,general,,Both,Axel Smith,,1600.0,2200.0,advanced,,24.0,0,0,0.0,1.0,0.0,,,,Training methods and study techniques for serious improvement.,intermediate,range_only,advanced
man__magnus_carlsen_masterclass,manual,Magnus Carlsen MasterClass,https://www.masterclass.com/classes/magnus-carlsen-teaches-chess,course,video,general,,Both,Magnus Carlsen,,1200.0,3000.0,intermediate,,90.0,0,1,0.0,0.0,0.0,,,,"Strategy, opening preparation and mindset by the world champion.",intermediate,fallback_lmin,intermediate
man__lichess_opening_explorer,manual,Lichess Opening Explorer,https://lichess.org/analysis,course,interactive,opening,,Both,Lichess,,0.0,3000.0,beginner,,0.0,1,0,0.0,1.0,0.0,,,,Free opening explorer with master game database and engine analysis.,beginner,range_only,beginner
man__chesstempo_tactics_trainer,manual,ChessTempo Tactics Trainer,https://chesstempo.com,course,interactive,tactics,,Both,ChessTempo,,800.0,3000.0,intermediate,,0.0,1,0,0.0,1.0,0.0,,,,Adaptive tactics training with spaced repetition and performance tracking.,beginner,range_only,intermediate
man__chess_com_lessons_beginners,manual,Chess.com Lessons — Beginners,https://www.chess.com/learn-how-to-play-chess,course,interactive,general,,Both,Chess.com,,0.0,1200.0,beginner,,0.0,1,1,0.0,1.0,0.0,,,,"Free introductory lessons covering opening principles, tactics and endgames.",beginner,range_only,beginner
man__bobby_fischer_teaches_chess,manual,Bobby Fischer Teaches Chess,https://www.amazon.com/s?k=Bobby+Fischer+Teaches+Chess,book,text,tactics,,Both,Bobby Fischer,,0.0,1500.0,beginner,,12.0,0,0,0.0,1.0,0.0,,,,Programmed study of back rank and related mates. Must-read for beginners.,beginner,range_only,beginner
man__play_winning_chess,manual,Play Winning Chess,https://www.amazon.com/s?k=Play+Winning+Chess+Seirawan,book,text,general,,Both,Yasser Seirawan,,0.0,1400.0,beginner,,18.0,0,0,0.0,1.0,0.0,,,,"Fundamentals of chess: tactics, strategy, endgames for absolute beginners.",beginner,range_only,beginner
man__chess_for_kids,manual,Chess for Kids,https://www.amazon.com/s?k=Chess+for+Kids+Murray+Chandler,book,text,general,,Both,Murray Chandler,,0.0,800.0,beginner,,10.0,0,0,0.0,1.0,0.0,,,,Simple and fun introduction to chess for young beginners.,beginner,range_only,beginner
man__square_one,manual,Square One,https://www.amazon.com/s?k=Square+One+Chess+Pandolfini,book,text,general,,Both,Bruce Pandolfini,,0.0,800.0,beginner,,12.0,0,0,0.0,1.0,0.0,,,,Teaches young beginners the rules and basic ideas.,beginner,range_only,beginner
man__comprehensive_chess_course_vol_i,manual,Comprehensive Chess Course Vol I,https://www.amazon.com/s?k=Comprehensive+Chess+Course+Alburt+Vol+1,book,text,general,,Both,GM Lev Alburt,GM,0.0,1200.0,beginner,,20.0,0,0,0.0,1.0,0.0,,,,Based on the Soviet training method. Teaches how to play with great basics.,beginner,range_only,beginner
man__chess_workbook_for_children,manual,Chess Workbook for Children,https://www.amazon.com/s?k=Chess+Workbook+Children+Bardwick,book,text,tactics,,Both,Todd Bardwick,,0.0,900.0,beginner,,15.0,0,0,0.0,1.0,0.0,,,,Excellent workbook at a young beginner level.,beginner,range_only,beginner
man__the_complete_idiot_s_guide_to_chess,manual,The Complete Idiot's Guide to Chess,https://www.amazon.com/s?k=Complete+Idiots+Guide+Chess+Wolff,book,text,general,,Both,GM Patrick Wolff,GM,0.0,1400.0,beginner,,16.0,0,0,0.0,1.0,0.0,,,,Excellent book for beginners. Covers how to play and key strategic tips.,beginner,range_only,beginner
man__chess_tactics_for_students,manual,Chess Tactics for Students,https://www.amazon.com/s?k=Chess+Tactics+for+Students+Bain,book,text,tactics,,Both,John Bain,,0.0,1300.0,beginner,,18.0,0,0,0.0,1.0,0.0,,,,"Learn motifs: pins, double attacks, back-rank mates. Essential workbook.",beginner,range_only,beginner
man__chess_tactics_for_kids,manual,Chess Tactics for Kids,https://www.amazon.com/s?k=Chess+Tactics+for+Kids+Chandler,book,text,tactics,,Both,GM Murray Chandler,GM,0.0,1400.0,beginner,,14.0,0,0,0.0,1.0,0.0,,,,Fun tactical puzzles for young improvers up to 1400.,beginner,range_only,beginner
man__how_to_beat_your_dad_at_chess,manual,How to Beat Your Dad at Chess,https://www.amazon.com/s?k=How+to+Beat+Your+Dad+at+Chess,book,text,tactics,,Both,GM Murray Chandler,GM,0.0,1600.0,beginner,,14.0,0,0,0.0,1.0,0.0,,,,50 deadly checkmate patterns every beginner must know.,beginner,range_only,beginner
man__everyone_s_first_chess_workbook,manual,Everyone's First Chess Workbook,https://www.amazon.com/s?k=Everyone+First+Chess+Workbook+Giannatos,book,text,tactics,,Both,Peter Giannatos,,0.0,1300.0,beginner,,22.0,0,0,0.0,1.0,0.0,,,,738 practical exercises from simplest tactics to interference. New 2021.,beginner,range_only,beginner
man__starting_out_chess_tactics_and_checkmates,manual,Starting Out: Chess Tactics and Checkmates,https://www.amazon.com/s?k=Starting+Out+Chess+Tactics+Checkmates+Ward,book,text,tactics,,Both,Chris Ward,,0.0,1200.0,beginner,,20.0,0,0,0.0,1.0,0.0,,,,Bridges the gap between a rules book and a more advanced tactics text.,beginner,range_only,beginner
man__logical_chess_move_by_move,manual,Logical Chess: Move by Move,https://www.amazon.com/s?k=Logical+Chess+Move+by+Move+Chernev,book,text,general,,Both,Irving Chernev,,0.0,1600.0,beginner,,18.0,0,0,0.0,1.0,0.0,,,,"33 master games explained move-by-move. Perfect for learning the ""why"".",beginner,range_only,beginner
man__winning_chess_strategies,manual,Winning Chess Strategies,https://www.amazon.com/s?k=Winning+Chess+Strategies+Seirawan,book,text,middlegame,,Both,Yasser Seirawan,,800.0,1600.0,intermediate,,20.0,0,0,0.0,1.0,0.0,,,,Strategy fundamentals explained accessibly. Part of the Winning Chess series.,beginner,range_only,intermediate
man__winning_chess_openings,manual,Winning Chess Openings,https://www.amazon.com/s?k=Winning+Chess+Openings+Seirawan,book,text,opening,,Both,Yasser Seirawan,,800.0,1600.0,intermediate,,20.0,0,0,0.0,0.0,0.0,,,,Opening principles and main systems for beginners.,beginner,range_only,intermediate
man__winning_chess_endings,manual,Winning Chess Endings,https://www.amazon.com/s?k=Winning+Chess+Endings+Seirawan,book,text,endgame,,Both,Yasser Seirawan,,800.0,1600.0,intermediate,,20.0,0,0,0.0,1.0,0.0,,,,Endgame fundamentals explained clearly for club players.,beginner,range_only,intermediate
man__fco_fundamental_chess_openings,manual,FCO: Fundamental Chess Openings,https://www.amazon.com/s?k=FCO+Fundamental+Chess+Openings+Van+der+Sterren,book,text,opening,,Both,Paul van der Sterren,,0.0,1800.0,beginner,,28.0,0,0,0.0,0.0,0.0,,,,Best intro-to-openings book. Explains reasons and history behind every opening.,beginner,range_only,beginner
man__chess_openings_for_white_explained,manual,Chess Openings for White Explained,https://www.amazon.com/s?k=Chess+Openings+White+Explained+Alburt,book,text,opening,,White,GM Lev Alburt,GM,0.0,1600.0,beginner,,25.0,0,0,0.0,0.0,0.0,,,,Complete White repertoire based on 1.e4 for beginners.,beginner,range_only,beginner
man__chess_openings_for_black_explained,manual,Chess Openings for Black Explained,https://www.amazon.com/s?k=Chess+Openings+Black+Explained+Alburt,book,text,opening,,Black,GM Lev Alburt,GM,0.0,1600.0,beginner,,25.0,0,0,0.0,0.0,0.0,,,,Complete Black repertoire for beginners.,beginner,range_only,beginner
man__1_e4_a_repertoire_for_white_after_1_e4,manual,1.e4! A Repertoire for White after 1.e4,https://www.amazon.com/s?k=1e4+Repertoire+White+Negi,book,text,opening,,White,GM Parimarjan Negi,GM,1000.0,1800.0,intermediate,,30.0,0,0,0.0,0.0,0.0,,,,Simple and effective 1.e4 repertoire for club players.,beginner,range_only,intermediate
man__the_london_system_in_12_practical_lessons,manual,The London System in 12 Practical Lessons,https://www.amazon.com/s?k=London+System+12+Practical+Lessons,book,text,opening,London System,White,GM Oscar de Prado,GM,0.0,1600.0,beginner,,22.0,0,0,0.0,0.0,0.0,,,,Learn the London System step by step. Great for beginners.,beginner,range_only,beginner
man__chess_openings_traps_and_zaps,manual,Chess Openings: Traps and Zaps,https://www.amazon.com/s?k=Chess+Openings+Traps+and+Zaps+Pandolfini,book,text,opening,,Both,Bruce Pandolfini,,0.0,1400.0,beginner,,14.0,0,0,0.0,0.0,0.0,,,,200+ traps and tricks in the opening. Fun and instructive.,beginner,range_only,beginner
man__pandolfini_s_endgame_course,manual,Pandolfini's Endgame Course,https://www.amazon.com/s?k=Pandolfini+Endgame+Course,book,text,endgame,,Both,Bruce Pandolfini,,0.0,1400.0,beginner,,16.0,0,0,0.0,1.0,0.0,,,,Straightforward examples of basic endgame ideas. Essential for beginners.,beginner,range_only,beginner
man__100_endgames_you_must_know,manual,100 Endgames You Must Know,https://www.amazon.com/s?k=100+Endgames+You+Must+Know+de+la+Villa,book,text,endgame,,Both,Jesus de la Villa,,800.0,1800.0,beginner,,28.0,0,0,0.0,1.0,0.0,,,,The 100 most important endgame positions. Highly recommended for all levels.,beginner,range_only,beginner
man__essential_chess_endings,manual,Essential Chess Endings,https://www.amazon.com/s?k=Essential+Chess+Endings+Howell,book,text,endgame,,Both,James Howell,,600.0,1600.0,beginner,,22.0,0,0,0.0,1.0,0.0,,,,Clear explanations of the most important endgame positions.,beginner,range_only,beginner
man__the_amateur_s_mind,manual,The Amateur's Mind,https://www.amazon.com/s?k=The+Amateur+Mind+Silman,book,text,middlegame,,Both,Jeremy Silman,,1200.0,1700.0,intermediate,,26.0,0,0,0.0,1.0,0.0,,,,Silman identifies and fixes the most common mistakes of club players.,intermediate,range_only,intermediate
man__how_to_reassess_your_chess,manual,How to Reassess Your Chess,https://www.amazon.com/s?k=How+to+Reassess+Your+Chess+Silman,book,text,middlegame,,Both,Jeremy Silman,,1400.0,2200.0,advanced,,35.0,0,0,0.0,1.0,0.0,,,,The #1 book for improvers. Teaches imbalances and middlegame planning.,intermediate,range_only,advanced
man__simple_chess,manual,Simple Chess,https://www.amazon.com/s?k=Simple+Chess+Stean,book,text,middlegame,,Both,Michael Stean,,1200.0,1800.0,intermediate,,18.0,0,0,0.0,1.0,0.0,,,,Simple and clear explanation of positional chess concepts.,intermediate,range_only,intermediate
man__chess_strategy_for_club_players,manual,Chess Strategy for Club Players,https://www.amazon.com/s?k=Chess+Strategy+for+Club+Players+Grooten,book,text,middlegame,,Both,Herman Grooten,,1200.0,1800.0,intermediate,,32.0,0,0,0.0,1.0,0.0,,,,Excellent strategic guide for club players. Covers pawn structures.,intermediate,range_only,intermediate
man__move_first_think_later,manual,Move First Think Later,https://www.amazon.com/s?k=Move+First+Think+Later+Hendriks,book,text,general,,Both,Willy Hendriks,,1200.0,2000.0,intermediate,,28.0,0,0,0.0,1.0,0.0,,,,Challenges conventional wisdom about chess improvement. Highly instructive.,intermediate,range_only,intermediate
man__improve_your_chess_pattern_recognition,manual,Improve Your Chess Pattern Recognition,https://www.amazon.com/s?k=Improve+Chess+Pattern+Recognition+Oudeweetering,book,text,tactics,,Both,Arthur van de Oudeweetering,,1200.0,1900.0,intermediate,,30.0,0,0,0.0,1.0,0.0,,,,Key moves and manoeuvres of the pieces. Pattern recognition training.,intermediate,range_only,intermediate
man__chess_tactics_from_scratch,manual,Chess Tactics from Scratch,https://www.amazon.com/s?k=Chess+Tactics+from+Scratch+Weteschnik,book,text,tactics,,Both,Martin Weteschnik,,1000.0,1800.0,intermediate,,26.0,0,0,0.0,1.0,0.0,,,,Understanding chess tactics. Explains the logic behind combinations.,intermediate,range_only,intermediate
man__the_step_by_step_method_complete_set,manual,The Step-by-Step Method Complete Set,https://www.newinchess.com/the-step-by-step-method,book,text,general,,Both,Rob Brunia & Co van Wijgerden,,0.0,1600.0,beginner,,60.0,0,0,0.0,1.0,0.0,,,,The most systematic chess training method. 6 levels from absolute beginner.,beginner,range_only,beginner
man__learn_chess_the_right_way_5_books,manual,Learn Chess the Right Way (5 books),https://www.amazon.com/s?k=Learn+Chess+Right+Way+Polgar,book,text,tactics,,Both,Susan Polgar,,0.0,1400.0,beginner,,15.0,0,0,0.0,1.0,0.0,,,,5-book series covering tactics systematically from beginner level.,beginner,range_only,beginner
man__chess_fundamentals_revisited,manual,Chess Fundamentals Revisited,https://www.amazon.com/s?k=Chess+Fundamentals+Revisited+Euwe,book,text,general,,Both,Max Euwe,,0.0,1400.0,beginner,,16.0,0,0,0.0,1.0,0.0,,,,Classic introduction to chess fundamentals by World Champion Euwe.,beginner,range_only,beginner
man__abc_s_of_chess,manual,ABC's of Chess,https://www.amazon.com/s?k=ABCs+of+Chess+Pandolfini,book,text,general,,Both,Bruce Pandolfini,,600.0,1400.0,beginner,,14.0,0,0,0.0,1.0,0.0,,,,Fundamental strategies and principles for improving beginners.,beginner,range_only,beginner
man__practical_chess_exercises,manual,Practical Chess Exercises,https://www.amazon.com/s?k=Practical+Chess+Exercises+Cheng,book,text,tactics,,Both,Ray Cheng,,1200.0,1800.0,intermediate,,22.0,0,0,0.0,1.0,0.0,,,,600 lessons from tactics to strategy. Excellent for all-round improvement.,intermediate,range_only,intermediate
man__tips_for_young_players,manual,Tips for Young Players,https://www.amazon.com/s?k=Tips+for+Young+Players+Sadler,book,text,general,,Both,GM Matthew Sadler,GM,1000.0,1600.0,intermediate,,18.0,0,0,0.0,1.0,0.0,,,,Further depth on fundamentals for improving players around 1200.,beginner,range_only,intermediate
man__chess_praxis,manual,Chess Praxis,https://www.amazon.com/s?k=Chess+Praxis+Nimzowitsch,book,text,middlegame,,Both,Aaron Nimzowitsch,,1400.0,2000.0,intermediate,,20.0,0,0,0.0,1.0,0.0,,,,Demonstration of the principles outlined in My System.,intermediate,range_only,intermediate
man__zurich_1953,manual,Zurich 1953,https://www.amazon.com/s?k=Zurich+International+Chess+Tournament+1953,book,text,general,,Both,David Bronstein,,1600.0,2400.0,advanced,,30.0,0,0,0.0,1.0,0.0,,,,Classic annotated tournament. Required reading for serious improvers.,advanced,range_only,advanced
ude__complete_guide_to_chess_for_beginners_0_to_15,udemy,Complete Guide to Chess for Beginners (0 to 1500),https://www.udemy.com/course/the-complete-beginners-guide-to-chess/,course,video,general,,Both,CM Kingscrusher,,0.0,1500.0,beginner,600.0,13.0,0,1,0.0,1.0,0.0,4.5,,,"Opening, middlegame, endgame fundamentals. Covers all main openings.",beginner,range_only,beginner
ude__chess_for_total_beginners,udemy,Chess for Total Beginners,https://www.udemy.com/course/learn-chess-from-scratch/,course,video,general,,Both,Katie,,0.0,1000.0,beginner,180.0,13.0,0,1,0.0,1.0,0.0,4.3,,,"Rules, basic strategy and improvement roadmap. Interviews with WGM players.",beginner,range_only,beginner
ude__first_moves_ultimate_beginner_chess_course,udemy,First Moves: Ultimate Beginner Chess Course,https://www.udemy.com/course/first-moves-the-ultimate-beginners-chess-course/,course,video,general,,Both,,,0.0,1000.0,beginner,120.0,13.0,0,1,0.0,1.0,0.0,4.2,,,"Fundamentals, checkmate patterns, puzzles. Downloadable exercise files.",beginner,range_only,beginner
ude__chess_beginner_level_lessons_with_fm_mike_iva,udemy,Chess Beginner Level Lessons with FM Mike Ivanov,https://www.udemy.com/course/chess-beginner-level-lessons/,course,video,general,,Both,FM Mike Ivanov,FM,0.0,1200.0,beginner,300.0,13.0,0,1,0.0,1.0,0.0,4.4,,,25 main points about pieces and how to use them together.,beginner,range_only,beginner
ude__chess_university_intro_to_chess_crash_course_,udemy,Chess University Intro to Chess Crash Course (FREE),https://www.udemy.com/course/chess-university-intro-to-chess-crash-course/,course,video,general,,Both,Chess University,,0.0,900.0,beginner,240.0,0.0,1,1,0.0,1.0,0.0,4.6,,,20 video lessons + 70 exercises. Free. Covers all rules and basic tactics.,beginner,range_only,beginner
ude__kids_learn_chess_the_fun_easy_way,udemy,Kids Learn Chess the Fun & Easy Way,https://www.udemy.com/course/funmastermike-teaches-all-chesskids/,course,video,general,,Both,FunMasterMike,,0.0,800.0,beginner,180.0,13.0,0,1,0.0,1.0,0.0,4.7,,,"Animated lessons for kids. Covers all pieces, tactics, checkmate patterns.",beginner,range_only,beginner
ude__chess_for_beginners_learn_chess_strategy_from,udemy,Chess for Beginners — Learn Chess Strategy From Scratch,https://www.udemy.com/course/chess-course/,course,video,general,,Both,Shervin House,,0.0,1200.0,beginner,300.0,13.0,0,1,0.0,1.0,0.0,4.4,,,"Complete fundamentals: openings, middlegame, endgame with puzzles.",beginner,range_only,beginner
ude__chess_for_beginners_foundation,udemy,Chess for Beginners — Foundation,https://www.udemy.com/course/chess-for-beginners-foundation/,course,video,general,,Both,,,0.0,1200.0,beginner,240.0,13.0,0,1,0.0,1.0,0.0,4.2,,,"For absolute beginners. Covers rules, tactics, FIDE tournament rules.",beginner,range_only,beginner
ude__chess_tactics_from_beginner_to_expert,udemy,Chess Tactics: From Beginner to Expert,https://www.udemy.com/topic/chess/,course,video,tactics,,Both,,,0.0,1600.0,beginner,300.0,13.0,0,1,0.0,1.0,0.0,4.3,,,Comprehensive tactics training from beginner to club level.,beginner,range_only,beginner
ude__chess_openings_the_easy_way,udemy,Chess Openings: The Easy Way,https://www.udemy.com/topic/chess/,course,video,opening,,Both,,,0.0,1400.0,beginner,240.0,13.0,0,1,0.0,0.0,0.0,4.2,,,Simple opening systems explained for beginners.,beginner,range_only,beginner
