resource_id,source,title,url,resource_type,format,course_type,openings,color,author,author_title,level_min,level_max,level_tier,duration_min,price_eur,is_free,has_video,has_pgn,has_exercises,has_spaced_rep,rating_score,views_yt,pub_date,description,level_tier_original,level_tier_source,level_tier_new
mc__caro_kann_according_to_dreev_beat_the_ad,modern_chess,Caro-Kann According to Dreev - Beat the Advance Variation with 3...c5,https://www.modern-chess.com/course/caro-kann-according-to-dreev-beat-the-advance-variation-with-3c5/47036/,course,video,opening,Caro-Kann Defense|1.e4,Both,"GMAlexey Dreev, GMPier Luigi Basso",GM,1200.0,3000.0,intermediate,360.0,,0,1,1.0,1.0,1.0,,,,"March 13, 2025Caro-Kann Defense1.e4",intermediate,fallback_lmin,intermediate
mc__beating_the_kan_variation_with_a2_a3,modern_chess,Beating the Kan Variation with a2-a3,https://www.modern-chess.com/course/beating-the-kan-variation-with-a2-a3/97003/,course,video,opening,Sicilian Defense|1.e4,Both,GMMichael Roiz,GM,1200.0,3000.0,intermediate,60.0,,0,1,1.0,1.0,1.0,,,,"Following the success of Beating the Taimanov and Sicilian Four Knights with a2-a3, GM Michael Roiz completes his comprehensive White repertoire against 1.e4 c5 2.Nf3 e6 with a deep dive into the Kan Variation. This second installment provides a strategic yet easy-to-learn system designed to limit B",intermediate,fallback_lmin,intermediate
mc__beat_the_anti_sicilians_practical_repert,modern_chess,Beat the Anti-Sicilians - Practical Repertoire for the Najdorf Players,https://www.modern-chess.com/course/beat-the-anti-sicilians-practical-repertoire-for-the-najdorf-players/56970/,course,video,opening,Sicilian Defense|1.e4,Both,"GMBaadur Jobava, IMDragos Ceres",GM,1200.0,3000.0,intermediate,300.0,,0,1,1.0,1.0,1.0,,,,"March 10, 2025Sicilian Defense1.e4",intermediate,fallback_lmin,intermediate
mc__beating_the_taimanov_and_sicilian_four_k,modern_chess,Beating the Taimanov and Sicilian Four Knights with a2-a3,https://www.modern-chess.com/course/beating-the-taimanov-and-sicilian-four-knights-with-a2-a3/16937/,course,video,opening,Sicilian Defense|1.e4,Both,GMMichael Roiz,GM,1200.0,3000.0,intermediate,120.0,,0,1,1.0,1.0,1.0,,,,This project presents a complete repertoire for White after:1.e4 c5 2.Nf3 e6The repertoire is structured into two courses:✅ Part 1 – Covers Taimanov and Sicilian Four Knights✅ Part 2 – Will be dedicated to the Kan VariationThis first course is built around a strategically rich yet easy-to-learn conc,intermediate,fallback_lmin,intermediate
mc__the_revamped_nimzo_indian_for_black,modern_chess,The Revamped Nimzo-Indian for Black,https://www.modern-chess.com/course/the-revamped-nimzo-indian-for-black/66904/,course,video,opening,Nimzo-Indian Defense|1.d4,Black,IMKushager Krishnater,IM,1200.0,3000.0,intermediate,180.0,,0,1,1.0,1.0,0.0,,,,"The Nimzo-Indian Defense has long been a top choice for elite players seeking a blend of positional solidity and dynamic counterplay. However, in today’s fast-evolving chess landscape, traditional lines are being analyzed to exhaustion, making it harder to surprise well-prepared opponents.",intermediate,fallback_lmin,intermediate
mc__beat_the_french_defense_part_2,modern_chess,Beat the French Defense - Part 2,https://www.modern-chess.com/course/beat-the-french-defense-part-2/26871/,course,video,opening,French Defense|1.e4,Both,"GMAlexey Dreev, GMBaadur Jobava, GMPier Luigi Basso",GM,1200.0,3000.0,intermediate,300.0,,0,1,1.0,1.0,1.0,,,,"March 5, 2025French Defense1.e4",intermediate,fallback_lmin,intermediate
mc__play_the_marshall_top_level_repertoire_a,modern_chess,Play the Marshall - Top-Level Repertoire against the Spanish,https://www.modern-chess.com/course/play-the-marshall-top-level-repertoire-against-the-spanish/76838/,course,video,opening,Ruy Lopez|1.e4,Both,GMIvan Cheparinov,GM,1200.0,3000.0,intermediate,420.0,,0,1,1.0,1.0,1.0,,,,"After having provided a full repertoire against the closed games with Queen’s Gambit Declined Part 1 & 2, GM Ivan Cheparinov goes to work on the most classic opening after 1.e4 – the Spanish. True to his uncompromising analytical style, he goes for the most principled of Black’s many possible system",intermediate,fallback_lmin,intermediate
mc__fundamental_pawn_structures_part_2,modern_chess,Fundamental Pawn Structures - Isolated Queen Pawn,https://www.modern-chess.com/course/fundamental-pawn-structures-part-2/36805/,course,video,middlegame,,Both,IMSiegfried Baumegger,IM,1200.0,3000.0,intermediate,120.0,,0,1,1.0,1.0,0.0,,,,"We are excited to introduce Fundamental Pawn Structures – Part 2, the next installment in IM Siegfried Baumegger’s strategic training series. This course continues the structured approach from Guided Practice (December) and focuses entirely on one of the most dynamic and instructive pawn structures ",intermediate,fallback_lmin,intermediate
mc__beat_the_french_defense,modern_chess,Beat the French Defense - Part 1,https://www.modern-chess.com/course/beat-the-french-defense/86772/,course,video,opening,French Defense|1.e4,Both,"GMAlexey Dreev, GMBaadur Jobava, GMPier Luigi Basso",GM,2300.0,3000.0,expert,300.0,,0,1,1.0,1.0,1.0,,,,"February 26, 2025French Defense1.e4",expert,range_only,expert
mc__my_queens_gambit_declined,modern_chess,My Queen's Gambit Declined,https://www.modern-chess.com/course/my-queens-gambit-declined/46739/,course,video,opening,Queen%27s Gambit Declined|1.d4,Both,GMIoannis Papaioannou,GM,1200.0,3000.0,intermediate,630.0,,0,1,1.0,0.0,0.0,,,,"This course is designed to provide you with a complete and  practical repertoire for Black against 1.d4 Nf6 2.c4 e6 3.Nf3 d5. The repertoire is based on 4.Nc3 Nbd7!? Even though 4.Nc3 is the main move, we will of course also cover all alternatives on move four—except for the Catalan, against which P",intermediate,fallback_lmin,intermediate
mc__dreev_university_rook_endgames,modern_chess,Dreev University - Rook Endgames,https://www.modern-chess.com/course/dreev-university-rook-endgames/96706/,course,video,endgame,,Both,"GMAlexey Dreev, GMPier Luigi Basso",GM,1200.0,3000.0,intermediate,120.0,,0,1,1.0,1.0,0.0,,,,"February 21, 2025",intermediate,fallback_lmin,intermediate
mc__sicilian_sidelines_for_2nc6_players,modern_chess,Sicilian Sidelines for 2...Nc6 Players,https://www.modern-chess.com/course/sicilian-sidelines-for-2nc6-players/56673/,course,video,opening,Sicilian Defense|1.e4,Both,IMKushager Krishnater,IM,1200.0,3000.0,intermediate,180.0,,0,1,1.0,1.0,1.0,,,,"Following the success of Play the Kalashnikov Sicilian, IM Kushager Krishnater presents an essential follow-up course that equips 2...Nc6 Sicilian players with a complete anti-sideline repertoire. Whether you play the Kalashnikov, Sveshnikov, Accelerated Dragon, Classical, or Taimanov, this course p",intermediate,fallback_lmin,intermediate
mc__must_know_strategies_with_a_fianchetto_b,modern_chess,Must-Know Strategies with a Fianchetto Bishop,https://www.modern-chess.com/course/must-know-strategies-with-a-fianchetto-bishop/16640/,course,video,general,,Both,GMIoannis Papaioannou,GM,1200.0,3000.0,intermediate,360.0,,0,1,1.0,1.0,0.0,,,,"The January edition of Strategy Wednesday, led by GM Ioannis Papaioannou, is now available as a digital product! This course explores the strategic principles of handling a fianchetto bishop, a critical piece in numerous openings, from the King’s Indian and Grünfeld to the Catalan and the English Op",intermediate,fallback_lmin,intermediate
mc__classical_spanish_middlegames,modern_chess,Classical Spanish Middlegames,https://www.modern-chess.com/course/classical-spanish-middlegames/66607/,course,video,middlegame,,Both,"GMBaadur Jobava, GMPier Luigi Basso",GM,1200.0,3000.0,intermediate,180.0,,0,1,1.0,0.0,0.0,,,,"February 13, 2025",intermediate,fallback_lmin,intermediate
mc__advanced_calculation_techniques,modern_chess,Advanced Calculation Techniques,https://www.modern-chess.com/course/advanced-calculation-techniques/26574/,course,video,tactics,,Both,GMDavorin Kuljasevic,GM,1800.0,2300.0,advanced,360.0,,0,1,1.0,1.0,0.0,,,,"We are excited to present Advanced Calculation Techniques, a new course by GM Davorin Kuljasevic, based on his January 2025 Tactical Thursday lectures. This course takes a structured approach to developing elite-level visualization skills and calculation techniques that are essential for every ambit",advanced,range_only,advanced
mc__play_the_kalashnikov_sicilian,modern_chess,Play the Kalashnikov Sicilian,https://www.modern-chess.com/course/play-the-kalashnikov-sicilian/76541/,course,video,opening,Sicilian Defense|1.e4,Both,IMKushager Krishnater,IM,1200.0,3000.0,intermediate,120.0,,0,1,1.0,1.0,1.0,,,,"We are excited to announce Play the Kalashnikov Sicilian, a brand-new course by IM Kushager Krishnater, offering a complete and dynamic repertoire for Black after 1.e4 c5 2.Nf3 Nc6 3.d4 cxd4 4.Nxd4 e5.The Kalashnikov Sicilian is an ideal weapon for the practical tournament player. Unlike many other ",intermediate,fallback_lmin,intermediate
mc__1d4_according_to_dreev_fight_the_bogo_in,modern_chess,1.d4 According to Dreev - Fight the Bogo-Indian Defense,https://www.modern-chess.com/course/1d4-according-to-dreev-fight-the-bogo-indian-defense/36508/,course,video,opening,Bogo-Indian Defense|1.d4,Both,"GMAlexey Dreev, GMPier Luigi Basso",GM,1200.0,3000.0,intermediate,360.0,,0,1,1.0,1.0,1.0,,,,"February 9, 2025Bogo-Indian Defense1.d4",intermediate,fallback_lmin,intermediate
mc__fundamental_pawn_structures_part_1,modern_chess,Fundamental Pawn Structures - Pawn Majorities and Pawn Chains,https://www.modern-chess.com/course/fundamental-pawn-structures-part-1/86475/,course,video,middlegame,,Both,IMSiegfried Baumegger,IM,2300.0,3000.0,expert,60.0,,0,1,1.0,1.0,0.0,,,,"We are excited to introduce Fundamental Pawn Structures – Part 1, a comprehensive course by IM Siegfried Baumegger, designed to elevate your strategic understanding of chess through pawn structure mastery. This course is based on his Guided Practice sessions from November, now transformed into a str",expert,range_only,expert
mc__mastering_the_maroczy_bind_strategic_fou,modern_chess,Mastering the Maroczy Bind: Strategic Foundations and Deep Plans,https://www.modern-chess.com/course/mastering-the-maroczy-bind-strategic-foundations-and-deep-plans/46442/,course,video,general,,Both,GMEvgeny Romanov,GM,2300.0,3000.0,expert,120.0,,0,1,1.0,1.0,0.0,,,,We are excited to welcome GM Evgeny Romanov to Modern Chess with his groundbreaking course Master the Maroczy Bind: Foundations and Deep Plans. This course provides in-depth strategic knowledge of one of the most fundamental pawn structures in chess—the Maroczy Bind.,expert,range_only,expert
mc__fight_the_english_opening_jobavas_repert,modern_chess,Fight the English Opening - Jobava's Repertoire,https://www.modern-chess.com/course/fight-the-english-opening-jobavas-repertoire/96409/,course,video,opening,English Opening|1.c4,Both,"GMBaadur Jobava, GMPier Luigi Basso",GM,1200.0,3000.0,intermediate,300.0,,0,1,1.0,1.0,1.0,,,,"February 2, 2025English Opening1.c4",intermediate,fallback_lmin,intermediate
mc__1d4_according_to_dreev_fight_the_slav_de,modern_chess,1.d4 According to Dreev - Fight the Slav Defense,https://www.modern-chess.com/course/1d4-according-to-dreev-fight-the-slav-defense/56376/,course,video,opening,Slav Defense|1.d4,Both,"GMAlexey Dreev, GMPier Luigi Basso",GM,1200.0,3000.0,intermediate,420.0,,0,1,1.0,1.0,1.0,,,,"January 30, 2025Slav Defense1.d4",intermediate,fallback_lmin,intermediate
mc__play_the_najdorf_top_level_repertoire_fo,modern_chess,Play the Najdorf - Top-Level Repertoire for Black,https://www.modern-chess.com/course/play-the-najdorf-top-level-repertoire-for-black/16343/,course,video,opening,Sicilian Defense|1.e4,Black,"GMBaadur Jobava, IMDragos Ceres",GM,1200.0,3000.0,intermediate,420.0,,0,1,1.0,1.0,1.0,,,,"January 28, 2025Sicilian Defense1.e4",intermediate,fallback_lmin,intermediate
mc__queens_gambit_declined_according_to_chep,modern_chess,Queen's Gambit Declined According to Cheparinov - Part 2,https://www.modern-chess.com/course/queens-gambit-declined-according-to-cheparinov-part-2/66310/,course,video,opening,Queen%27s Gambit Declined|1.d4,Both,GMIvan Cheparinov,GM,1200.0,3000.0,intermediate,420.0,,0,1,1.0,1.0,1.0,,,,"GM Ivan Cheparinov has released the second part of his extensive repertoire based on the Queen’s Gambit Declined. After having studied the ins and outs of the main lines of the QGD in Part 1, the author provides a cutting-edge repertoire against everything else after 1.d4 while also covering 1.c4 an",intermediate,fallback_lmin,intermediate
mc__my_practical_spanish_repertoire_for_whit,modern_chess,My Practical Spanish Repertoire for White,https://www.modern-chess.com/course/my-practical-spanish-repertoire-for-white/26277/,course,video,opening,Ruy Lopez|1.e4,White,GMIoannis Papaioannou,GM,1200.0,3000.0,intermediate,630.0,,0,1,1.0,0.0,0.0,,,,The camp My Practical Spanish Repertoire for White is now available as a digital product! This comprehensive course includes all the videos from the camp as well as the PGN file related to the training sessions. The material consists of 10.5 hours of video and a PGN database with 145 files!,intermediate,fallback_lmin,intermediate
mc__structured_calculation_master_the_ply_th,modern_chess,Structured Calculation - Master the Ply Theory,https://www.modern-chess.com/course/structured-calculation-master-the-ply-theory/76244/,course,video,middlegame,,Both,GMDavorin Kuljasevic,GM,1800.0,2300.0,advanced,,,0,1,1.0,1.0,0.0,,,,"We are delighted to announce that the December edition of Tactical Thursday by GM Davorin Kuljasevic is now available as a digital product. In this insightful series, GM Kuljasevic continues to delve into his groundbreaking Ply Theory, providing a structured approach to calculation that combines cla",advanced,range_only,advanced
mc__100_moves_to_2700,modern_chess,100 Moves to 2700,https://www.modern-chess.com/course/100-moves-to-2700/36211/,course,video,general,,Both,"GMAlexey Dreev, GMPier Luigi Basso",GM,1200.0,3000.0,intermediate,300.0,,0,1,1.0,1.0,0.0,,,,"January 21, 2025",intermediate,fallback_lmin,intermediate
mc__caro_kann_according_to_dreev_part_3,modern_chess,Caro-Kann According to Dreev - Part 3,https://www.modern-chess.com/course/caro-kann-according-to-dreev-part-3/46145/,course,video,opening,Caro-Kann Defense|1.e4,Both,"GMAlexey Dreev, GMPier Luigi Basso",GM,1200.0,3000.0,intermediate,,,0,1,1.0,1.0,1.0,,,,"January 14, 2025Caro-Kann Defense1.e4",intermediate,fallback_lmin,intermediate
mc__top_level_repertoire_against_queens_gamb,modern_chess,Top-Level Repertoire against Queen's Gambit Accepted,https://www.modern-chess.com/course/top-level-repertoire-against-queens-gambit-accepted/56079/,course,video,opening,Queen%27s Gambit Accepted|1.d4,Both,GMIgor Lysyj,GM,1200.0,3000.0,intermediate,180.0,,0,1,1.0,1.0,1.0,,,,"We are excited to present a comprehensive new course by GM Igor Lysyj, Top-Level Repertoire Against the Queen's Gambit Accepted. This course is designed to provide White with a complete, high-quality repertoire against one of the most reliable defenses in modern chess—1.d4 d5 2.c4 dxc4.With 12 theor",intermediate,fallback_lmin,intermediate
mc__endgames_with_minor_pieces,modern_chess,Endgames with Minor Pieces,https://www.modern-chess.com/course/endgames-with-minor-pieces/16046/,course,video,endgame,,Both,GMIoannis Papaioannou,GM,2300.0,3000.0,expert,,,0,1,1.0,1.0,0.0,,,,"The December edition of Strategy Wednesday, led by GM Ioannis Papaioannou, is now available as a digital product! This course dives into the fascinating world of endgames with minor pieces, exploring their strategic depth and practical challenges.Through 4 in-depth lectures, GM Papaioannou provides ",expert,range_only,expert
mc__sidelines_after_1d4_nf6_top_level_repert,modern_chess,Sidelines after 1.d4 Nf6 - Top-Level Repertoire for Black,https://www.modern-chess.com/course/sidelines-after-1d4-nf6-top-level-repertoire-for-black/66013/,course,video,opening,Trompowsky Attack|Torre Attack|Veresov Attack|Colle System|1.d4,Black,GMMichael Roiz,GM,1200.0,3000.0,intermediate,,,0,1,1.0,1.0,1.0,,,,"We are excited to introduce another outstanding course by GM Michael Roiz – Sidelines after 1.d4 Nf6: Top-Level Repertoire for Black. Following the success of Fighting the London System, GM Roiz now completes his comprehensive repertoire against White's alternatives to 2.c4.",intermediate,fallback_lmin,intermediate
mc__fighting_the_london_system,modern_chess,Fighting the London System,https://www.modern-chess.com/course/fighting-the-london-system/25980/,course,video,opening,London System|1.d4,Both,GMMichael Roiz,GM,1200.0,3000.0,intermediate,,,0,1,1.0,1.0,1.0,,,,We are thrilled to introduce another exceptional project by GM Michael Roiz – Fighting the London System. This course is part of a comprehensive series aimed at covering all White's sidelines after 1.d4 Nf6. The second installment of the project will focus on the Trompowsky Attack and other alternat,intermediate,fallback_lmin,intermediate
mc__caro_kann_according_to_dreev_part_2,modern_chess,Caro-Kann According to Dreev - Part 2,https://www.modern-chess.com/course/caro-kann-according-to-dreev-part-2/75947/,course,video,opening,Caro-Kann Defense|1.e4,Both,"GMAlexey Dreev, GMPier Luigi Basso",GM,1200.0,3000.0,intermediate,,,0,1,1.0,1.0,1.0,,,,"January 4, 2025Caro-Kann Defense1.e4",intermediate,fallback_lmin,intermediate
mc__calculation_and_modern_thinking_with_im_,modern_chess,Calculation and Modern Thinking with IM Shantanu Bhambure,https://www.modern-chess.com/course/calculation-and-modern-thinking-with-im-shantanu-bhambure/35914/,course,video,tactics,,Both,Modern Chess Team,,2300.0,3000.0,expert,,,0,1,0.0,0.0,0.0,,,,"International Master Shantanu Bhambure introduces a simple three-step framework to enhance your calculation skills in chess. First, pinpoint the most compelling move to create immediate threats. Next, tackle obstacles by adopting a strategic mindset of mutual consideration. Finally, narrow down your",expert,range_only,expert
mc__jobava_london_reversed_top_level_reperto,modern_chess,Jobava London Reversed - Top-Level Repertoire for Black,https://www.modern-chess.com/course/jobava-london-reversed-top-level-repertoire-for-black/85881/,course,video,opening,Reti Opening|1.Nf3,Black,"GMBaadur Jobava, GMPier Luigi Basso",GM,1200.0,3000.0,intermediate,,,0,1,1.0,1.0,1.0,,,,"January 1, 2025Reti Opening1.Nf3",intermediate,fallback_lmin,intermediate
mc__beat_the_anti_sicilians_top_level_repert,modern_chess,Beat the Anti-Sicilians - Top-Level Repertoire for Black,https://www.modern-chess.com/course/beat-the-anti-sicilians-top-level-repertoire-for-black/45848/,course,video,opening,Sicilian Defense|1.e4,Black,GMArjun Kalyan,GM,1200.0,3000.0,intermediate,,,0,1,1.0,1.0,1.0,,,,"We’re excited to announce the release of GM Arjun Kalyan’s new course, Beat the Anti-Sicilians - Top-Level Repertoire for Black, designed to help you handle all the deviations White has at their disposal on moves 2 and 3. This course is the perfect complement to GM Kalyan's previous course, My Class",intermediate,fallback_lmin,intermediate
mc__strategic_repertoire_against_the_sicilia,modern_chess,Strategic Repertoire against the Sicilian Defense - 1.e4 c5 2.Nf3 d6 3.Bb5+,https://www.modern-chess.com/course/strategic-repertoire-against-the-sicilian-defense/95815/,course,video,opening,Sicilian Defense|1.e4,Both,GMIoannis Papaioannou,GM,1200.0,3000.0,intermediate,630.0,,0,1,1.0,0.0,0.0,,,,"The camp Strategic Repertoire against the Sicilian - 1.e4 c5 2.Nf3 d6 3.Bb5+ is already a digital product. This product includes all the videos from the camp as well as the PGN file related to the training sessions. Overall, the material consists of 10.5 hours of video and a PGN database, which incl",intermediate,fallback_lmin,intermediate
mc__caro_kann_according_to_dreev_part_1,modern_chess,Caro-Kann According to Dreev - Part 1,https://www.modern-chess.com/course/caro-kann-according-to-dreev-part-1/55782/,course,video,opening,Caro-Kann Defense|1.e4,Both,"GMAlexey Dreev, GMPier Luigi Basso",GM,1200.0,3000.0,intermediate,,,0,1,1.0,1.0,1.0,,,,"December 26, 2024Caro-Kann Defense1.e4",intermediate,fallback_lmin,intermediate
mc__my_classical_sicilian_top_level_repertoi,modern_chess,My Classical Sicilian - Top-Level Repertoire for Black,https://www.modern-chess.com/course/my-classical-sicilian-top-level-repertoire-for-black/15749/,course,video,opening,Sicilian Defense|1.e4,Black,GMArjun Kalyan,GM,1200.0,3000.0,intermediate,,,0,1,1.0,1.0,1.0,,,,"We are thrilled to announce the release of My Classical Sicilian - Top-Level Repertoire for Black, a new course by GM Arjun Kalyan, providing an ambitious and principled repertoire for Black.",intermediate,fallback_lmin,intermediate
mc__essential_middlegames_for_club_players_w,modern_chess,Essential Middlegames for Club Players with IM Kushager Krishnater,https://www.modern-chess.com/course/essential-middlegames-for-club-players-with-im-kushager-krishnater/65716/,course,video,middlegame,,Both,IMKushager Krishnater,IM,1200.0,1800.0,intermediate,600.0,,0,1,1.0,0.0,0.0,,,,"Did you know that 9 out of 10 games are decided in the middlegame? Mastering this critical phase can make you unstoppable in most of your matches. That’s why we’ve teamed up with IM Kushager Krishnater to bring you the Essential Middlegames for Club Players course—an in-depth, 10-hour and 20-minute ",intermediate,range_only,intermediate
mc__symmetrical_positions,modern_chess,Symmetrical Positions,https://www.modern-chess.com/course/symmetrical-positions/25683/,course,video,general,,Both,GMIoannis Papaioannou,GM,1800.0,2300.0,advanced,360.0,,0,1,1.0,1.0,0.0,,,,"The November edition of Strategy Wednesday, led by GM Ioannis Papaioannou, is now available as a digital product! This course offers a comprehensive exploration of symmetrical positions, focusing on their strategic and dynamic subtleties.Through 4 in-depth lectures, GM Papaioannou explains how to ha",advanced,range_only,advanced
mc__the_ambitious_queens_gambit_accepted,modern_chess,The Ambitious Queen's Gambit Accepted,https://www.modern-chess.com/course/the-ambitious-queens-gambit-accepted/75650/,course,video,opening,Queen%27s Gambit Accepted|1.d4,Both,"GMBaadur Jobava, GMPier Luigi Basso",GM,1200.0,3000.0,intermediate,201.0,,0,1,1.0,1.0,1.0,,,,"December 17, 2024Queen's Gambit Accepted1.d4",intermediate,fallback_lmin,intermediate
mc__typical_calculation_mistakes,modern_chess,Typical Calculation Mistakes,https://www.modern-chess.com/course/typical-calculation-mistakes/35617/,course,video,tactics,,Both,GMDavorin Kuljasevic,GM,1200.0,3000.0,intermediate,360.0,,0,1,1.0,1.0,0.0,,,,"The Tactical Thursday camp on Typical Calculation Mistakes is now available as a digital product, offering a comprehensive and practical guide to improving your ability to calculate variations. This product includes all the video lectures from the camp, along with a PGN file that complements the tra",intermediate,fallback_lmin,intermediate
mc__1d4_according_to_dreev_play_the_catalan_,modern_chess,1.d4 According to Dreev - Play the Catalan - Part 2,https://www.modern-chess.com/course/1d4-according-to-dreev-play-the-catalan-part-2/85584/,course,video,opening,Catalan Opening|1.d4,Both,"GMAlexey Dreev, GMPier Luigi Basso",GM,1200.0,3000.0,intermediate,427.0,,0,1,1.0,1.0,1.0,,,,"December 13, 2024Catalan Opening1.d4",intermediate,fallback_lmin,intermediate
mc__play_the_okelly_sicilian_top_level_reper,modern_chess,Play the O'Kelly Sicilian - Top-Level Repertoire for Black,https://www.modern-chess.com/course/play-the-okelly-sicilian-top-level-repertoire-for-black-3h/45551/,course,video,opening,Sicilian Defense|1.e4,Black,GMS.P Sethuraman,GM,1200.0,3000.0,intermediate,360.0,,0,1,1.0,1.0,1.0,,,,We are happy to announce that the strong Indian GM and theoretician S.P Sethuraman comes up with another amazing course - Play the O'Kelly Sicilian - Top-Level Repertoire for Black.The starting position of this exciting variation is being reached after 1.e4 c5 2.Nf3 a6he O'Kelly Sicilian is a dynami,intermediate,fallback_lmin,intermediate
mc__queens_gambit_declined_gukeshs_4_h6,modern_chess,Queen's Gambit Declined - Gukesh's 4...h6,https://www.modern-chess.com/course/queens-gambit-declined-gukeshs-4-h6/55485/,course,video,opening,Queen%27s Gambit Declined,Both,GMMichael Roiz,GM,1200.0,3000.0,intermediate,180.0,,0,1,1.0,1.0,1.0,,,,"We are thrilled to introduce GM Michael Roiz's latest course, offering a complete and practical repertoire for Black with the innovative move 4...h6 in the Queen's Gambit Declined:1.d4 Nf6 2.c4 e6 3.Nf3 d5 4.Nf3 h6!?This creative idea has gained significant traction at the top level, with Gukesh emp",intermediate,fallback_lmin,intermediate
mc__1_d4_according_to_dreev_play_the_catalan,modern_chess,1.d4 According to Dreev - Play the Catalan - Part 1,https://www.modern-chess.com/course/1-d4-according-to-dreev-play-the-catalan-part-1/15452/,course,video,opening,Catalan Opening|1.d4,Both,"GMAlexey Dreev, GMPier Luigi Basso",GM,1200.0,3000.0,intermediate,283.0,,0,1,1.0,1.0,1.0,,,,"November 29, 2024Catalan Opening1.d4",intermediate,fallback_lmin,intermediate
mc__high_level_defense_strategies,modern_chess,High-Level Defense Strategies,https://www.modern-chess.com/course/high-level-defense-strategies/65419/,course,video,opening,,Both,GMDejan Bojkov,GM,1200.0,3000.0,intermediate,540.0,,0,1,1.0,0.0,1.0,,,,The camp of GM Bojkov - High-Level Defense Strategies is already a digital product.,intermediate,fallback_lmin,intermediate
